[
    {
        "employeeId": "18129",
        "employee": {
            "name": "lorem ipsum",
            "username": "lipsum",
            "email": "lipsum@resmo.com"
        },
        "createdAt": "2021-11-20",
        "department": "Integrations",
        "salary": 1230.0,
        "manager": "dolor",
        "active": true
      },
      {
        "employeeId": "89848",
        "employee": {
            "name": "dolor",
            "username": "dolor",
            "email": "dolor@resmo.com"
        },
        "createdAt": "2019-09-12",
        "department": "Management",
        "salary": 2100.0,
        "manager": "",
        "active": true
      },
      {
        "employeeId": "16548",
        "employee": {
            "name": "sit amet",
            "username": "samet",
            "email": "samet@resmo.com"
        },
        "createdAt": "2022-05-17",
        "department": "IT",
        "salary": 1000.0,
        "manager": "lipsum",
        "active": false
      }
]